{"answer":{"callee":"checkoutservice-1","caller":"frontend-2"},"answer_type":"directed_edge","derivation":"direct lookup of the selected concrete directed edge","query_hash":"506015703028110c3ae55872eecfc21d57d3a8e8704ffb4cb6c1517b48530b43","query_id":"Q-0360650805693083","schema_version":"PrivateAnswerKeyV1","supporting_fact_ids":["F6D39DF8F410C"]}
