{"answer":["frontend","cartservice","redis"],"answer_type":"ordered_path","derivation":"label-blind shortest path derived from the supplied directed edges","query_hash":"d8f9489c5975bf5fcb9164b3a5bfe17828ab47e0e9447cbad31ce5149e37f2fd","query_id":"Q-1984B16D3503A7E0","schema_version":"PrivateAnswerKeyV1","supporting_fact_ids":["F9D85097B9076","F92100A1BD165","F1097EE5EF297"]}
