{"answer":["adservice-1"],"answer_type":"sorted_string_set","derivation":"maximum label-blind per-entity modality availability count with ties retained","query_hash":"c609c8158def8fd57f0243c76539caaae350b30eba121d5eb20cf3bf529831fd","query_id":"Q-66A552A3258888C6","schema_version":"PrivateAnswerKeyV1","supporting_fact_ids":["F73881F586BA9","F9DDDCEEBA40E","FB323130E5C00","FF76DA5632F08","FA9EA0D5DC7DA","F7285123C8897","F9E5C4CB702DA","FDFD59DCDEE02","FD2C022426212","F4D3F54EB908A","F90E82C06C2E6","FF77800957420","F0D13F626FF0E","F39CC1AF2E1C4","F3B0182019CC3","F9D9EF479C325","F7674E9EC249A","F2C951543A468","F32FD7CECE7E2","FF71F3B7D9B9C","F9759BDE48638","F56278CB4DB52","F5D7EE7DC7A44","FFFAA5AC30467"]}
