{"answer":["ts-consign-service"],"answer_type":"sorted_string_set","derivation":"maximum label-blind per-entity modality availability count with ties retained","query_hash":"a5bf7ed50d1c655f502df44898b7b2e155abd7feabf980e15edc85f5e7c41cf8","query_id":"Q-538563F6C3731F61","schema_version":"PrivateAnswerKeyV1","supporting_fact_ids":["FE1E9ACC485A7","F2573924DCA9E","F2F3F6C489EF0","F72AAB57344CC","F8465C892948E","FD707DF800966","FBDC65FF1B0C2","F7AF4898E5290","F7CB9B24B1856","F01742B730AA2","F3E6A45E8D35B","FF9D59B2B5EC9","FAC9F43BFC7E6","F0004CB63C190","F65906162126C","FF4FCEC2FFE2A","F213701751194","F89307BEF3D32","F34E17872E182","FEF07D3AE674D","F01DE8AC01805","F2C39A358FCAD","F0E84624854FE","F97226587B2EE"]}
