{"answer":["checkoutservice","cartservice","redis"],"answer_type":"ordered_path","derivation":"label-blind shortest path derived from the supplied directed edges","query_hash":"afc711dff08126017f7ecbfe6be6fc604cd1ea473faf20aceb7e1104c5b81d5d","query_id":"Q-6BD619AFB12AB5F8","schema_version":"PrivateAnswerKeyV1","supporting_fact_ids":["FC5AA685E6D73","F85F8D3B0065D","F1097EE5EF297"]}
