{"answer":273.07,"answer_type":"number","derivation":"direct lookup of the selected metric-bin fact","query_hash":"0b92069f6bfeaf11a776366f0012e4198bf7a988f87e4fd4fe359294e4ed169f","query_id":"Q-127E4504572A5120","schema_version":"PrivateAnswerKeyV1","supporting_fact_ids":["FB773A6ABF416","F36CC90C7AB4E","FF552922E73A3"]}
