{"answer":["k8s-master1","node-6"],"answer_type":"sorted_string_set","derivation":"min over the supplied onset_rel_s facts with ties retained","query_hash":"688c9dd6c448f4c385810c4174f15cc7d8e1a209bd43857323dd92ca3ddb18d8","query_id":"Q-3687B6D01E05E7D2","schema_version":"PrivateAnswerKeyV1","supporting_fact_ids":["F6EF4EC6C2E72","FD1CC4CA6A0B9"]}
