{"answer":["frontend","cartservice","redis"],"answer_type":"ordered_path","derivation":"label-blind shortest path derived from the supplied directed edges","query_hash":"acb58172f9fdcfee0b09c6f816464ad35bd23adc53644a16e0c65b82a933b49a","query_id":"Q-DFB256182EC65543","schema_version":"PrivateAnswerKeyV1","supporting_fact_ids":["F9D85097B9076","F92100A1BD165","F1097EE5EF297"]}
