{"answer":["ts-security-service"],"answer_type":"sorted_string_set","derivation":"max over the supplied persistence_bins facts with ties retained","query_hash":"9e5091d0899555fd7afed7a51d7da949b8a52ffb661c5393dfac1089860f1f6e","query_id":"Q-569B35213DC59B55","schema_version":"PrivateAnswerKeyV1","supporting_fact_ids":["F8816E0FF8A48","FCEBF6ABD0ECE","F1E9291ED11D8"]}
