{"answer":{"callee":"ts-train-food-service","caller":"ts-food-service"},"answer_type":"directed_edge","derivation":"direct lookup of the selected concrete directed edge","query_hash":"4d2381a7687278d07415095ae234b36ec97f374162ef71f77fba87ad9fa2053f","query_id":"Q-98EEFDDEA425B897","schema_version":"PrivateAnswerKeyV1","supporting_fact_ids":["F0643FA301D1E"]}
