{"answer":["frontend","checkoutservice","emailservice"],"answer_type":"ordered_path","derivation":"unique unweighted shortest path derived privately from the supplied directed edges; no path fact is model-visible","query_hash":"dc9b5b0812cb273ffea9409a8a879583294221d8934cd1964149f1e76698ecde","query_id":"Q-7E4BED0F4F8FB390","schema_version":"PrivateAnswerKeyV1","supporting_fact_ids":["F354D58B3B513","FCD1612ECAB68"]}
