{"answer":{"panels":[{"onset":14,"panel_id":"M1","sign":"positive","support_bins":[14,15]},{"onset":14,"panel_id":"M2","sign":"positive","support_bins":[14,15]},{"onset":7,"panel_id":"M3","sign":"negative","support_bins":[7,8]},{"onset":null,"panel_id":"M4","sign":null,"support_bins":[]},{"onset":null,"panel_id":"M5","sign":null,"support_bins":[]},{"onset":null,"panel_id":"M6","sign":null,"support_bins":[]},{"onset":null,"panel_id":"M7","sign":null,"support_bins":[]},{"onset":null,"panel_id":"M8","sign":null,"support_bins":[]},{"onset":null,"panel_id":"M9","sign":null,"support_bins":[]},{"onset":null,"panel_id":"M10","sign":null,"support_bins":[]},{"onset":14,"panel_id":"M11","sign":"positive","support_bins":[14,15]},{"onset":null,"panel_id":"M12","sign":null,"support_bins":[]}]},"answer_type":"panel_onset_ledger","derivation":"derive every panel onset and supporting pair privately from the supplied normalized bins; no onset or winner is model-visible","query_hash":"2bbe3b9eece10a97a1e9f6d6e052d82ed1dff5028c17ed82a91ae81af37f7cd3","query_id":"Q-6751B74937C85BD8","schema_version":"PrivateAnswerKeyV1","supporting_fact_ids":["FE59EF3A9589C","FD0461099103F","F6FD9454940C7","F2E2ECE8B926A","FD4AB675E8F17","FFA814756AE23","F5B31204AB3E4","F1CC742F83BF0","F9DAEFDF47311","F57A30C52A3AD","F255E3FA70D8F","FE04D6AB86DD5"]}
