{"answer":["node-7","paymentservice-1","paymentservice-2","tidb-tidb"],"answer_type":"sorted_string_set","derivation":"max over the supplied persistence_bins facts with ties retained","query_hash":"d6051b5ce74f7349011b29622fac0cc6b0f11bdddf5cd64b98c16e24490bcef2","query_id":"Q-F89574B0C4C5574F","schema_version":"PrivateAnswerKeyV1","supporting_fact_ids":["F0202E4A733AD","F7F94D08AC9FF","F32A5895F15FC","F622CD419CB7A"]}
