{"answer":["M11","M12"],"answer_type":"sorted_string_set","derivation":"derive each panel onset from the supplied normalized bins, then take the minimum with complete ties; no onset fact is model-visible","query_hash":"6a1bb309cbbf058c31df7b7ae056d1557eeee2d519ec935864132464e340f929","query_id":"Q-4381B64FA667E0C7","schema_version":"PrivateAnswerKeyV1","supporting_fact_ids":["F7AD1431CE395","FD972ABF4D0C4","FA318FCD9A5D6","F66DB8C43EB3E","F119B85D42D72","F284C5CA16464","F71F25C04D977","FF295AF2B4004","F146266F47E37","F124B221B9ABA","F65DCFE1C4BEE","FF5222146B7C7"]}
